{
  "$schema": "https://json-schema.org/draft/2020-12/schema",
  "$id": "https://deddal.app/schemas/seed-data/cases.json",
  "title": "Method Cases Seed Data Schema",
  "description": "JSON Schema for Rubik's Cube method case seed data files (seeddata_cases_*.json). Each case represents an individual algorithm case (e.g., 'T Perm', 'F2L-01-FR', 'OLL-21').",
  "type": "array",
  "items": {
    "type": "object",
    "required": ["id", "code", "kind"],
    "additionalProperties": false,
    "properties": {
      "id": {
        "type": "string",
        "pattern": "^[0-9a-fA-F]{8}-[0-9a-fA-F]{4}-[0-9a-fA-F]{4}-[0-9a-fA-F]{4}-[0-9a-fA-F]{12}$",
        "description": "Unique identifier (UUID v4)"
      },
      "code": {
        "type": "string",
        "minLength": 1,
        "description": "Unique code identifier for the case (e.g., 'T-Perm', 'F2L-01-FR', 'OLL-21', 'CLL-AS-01')",
        "examples": ["T-Perm", "F2L-01-FR", "OLL-21", "CLL-AS-01"]
      },
      "case_set_id": {
        "type": ["string", "null"],
        "pattern": "^[0-9a-fA-F]{8}-[0-9a-fA-F]{4}-[0-9a-fA-F]{4}-[0-9a-fA-F]{4}-[0-9a-fA-F]{12}$",
        "description": "Foreign key reference to case sets table (optional, some cases may not belong to a set)"
      },
      "title": {
        "type": ["string", "null"],
        "description": "Display title for the case",
        "examples": ["T Permutation", "Anti-Sune 1", "Fish Pattern"]
      },
      "long_name": {
        "type": ["string", "null"],
        "description": "Full descriptive name for the case",
        "examples": ["CLL Anti-Sune Case 1", "F2L Front-Right Case 1"]
      },
      "kind": {
        "type": "string",
        "minLength": 1,
        "description": "Case kind/type. Values are dynamically discovered from database. Common values include: 'f2l', 'oll', 'pll', 'cll', 'ortega_oll', 'ortega_pbl', 'lbl_daisy', 'unspecified'",
        "examples": ["f2l", "oll", "pll", "cll", "ortega_oll", "ortega_pbl", "lbl_daisy"]
      },
      "pattern_from": {
        "type": ["string", "null"],
        "description": "Pattern state before solving this case (serialized representation)",
        "examples": ["F2L Complete", "Cross Done", "Opposite Face Oriented"]
      },
      "pattern_to": {
        "type": ["string", "null"],
        "description": "Pattern state after solving this case (serialized representation)",
        "examples": ["Solved", "Last Layer Oriented", "Permuted Last Layer"]
      },
      "scramble": {
        "type": ["string", "null"],
        "description": "Scramble notation sequence to reach this case from solved state",
        "examples": ["R U R' U' R' F R2 U' R' U' R U R' F'"]
      },
      "notes": {
        "type": ["string", "null"],
        "description": "General notes about the case (recognition tips, common errors, etc.)",
        "examples": ["Anti-Sune subset", "Mirror of Sune", "Common in speedsolving"]
      },
      "story": {
        "type": ["string", "null"],
        "description": "Story or mnemonic for remembering the case recognition or solution"
      },
      "description": {
        "type": ["string", "null"],
        "description": "Detailed description of the case and its characteristics"
      },
      "image_url": {
        "type": ["string", "null"],
        "format": "uri",
        "description": "Cloud URL to case image in Supabase Storage (primary image source)",
        "examples": ["https://storage.supabase.co/v1/object/public/cases/oll-21.png"]
      },
      "image_asset_name": {
        "type": ["string", "null"],
        "description": "Bundled asset name in app bundle (fallback image source). Format: caseimg_{code}",
        "examples": ["2x2_cll_cll_as1", "caseimg_oll_21"]
      },
      "difficulty": {
        "type": ["integer", "null"],
        "minimum": 1,
        "maximum": 5,
        "description": "Difficulty rating from 1 (easiest) to 5 (hardest)",
        "examples": [1, 3, 5]
      },
      "popularity": {
        "type": ["integer", "null"],
        "minimum": 0,
        "maximum": 100,
        "description": "Popularity score from 0 (least popular) to 100 (most popular)",
        "examples": [25, 50, 85]
      },
      "groups": {
        "type": ["array", "null"],
        "description": "Recognition groups for multi-dimensional categorization. Each string follows 'category:value' format (e.g., 'slot:FR', 'level:beginner', 'puzzle:2x2')",
        "items": {
          "type": "string",
          "pattern": "^[a-zA-Z0-9_/-]+:[a-zA-Z0-9_/-]+$",
          "description": "Group in 'category:value' format (allows letters, numbers, underscore, hyphen, and slash)"
        },
        "examples": [
          ["puzzle:2x2", "family:pbl-adj", "level:advanced"],
          ["slot:FR", "level:beginner"],
          ["pair_u_relationship:n/a"]
        ]
      },
      "created_at": {
        "type": ["string", "null"],
        "format": "date-time",
        "description": "Creation timestamp in ISO 8601 format with timezone",
        "examples": ["2025-01-10T00:00:00.000Z"]
      },
      "updated_at": {
        "type": ["string", "null"],
        "format": "date-time",
        "description": "Last update timestamp in ISO 8601 format with timezone",
        "examples": ["2025-01-10T00:00:00.000Z"]
      }
    }
  },
  "minItems": 1,
  "description": "Array must contain at least one case"
}
