[
  {
    "id": "95f41767-b0a2-54ef-a640-c40dd6106cdb",
    "code": "OcLL Antisune",
    "case_set_id": "92b51515-6df7-4548-87b0-b4445323b509",
    "title": "Antisune",
    "long_name": "OcLL Antisune (OLL 26)",
    "kind": "ocll",
    "pattern_from": "Top Edges Oriented",
    "pattern_to": "Top Oriented",
    "scramble": "R U2 R' U' R U' R'",
    "notes": "Mirror of Sune case",
    "story": null,
    "description": null,
    "image_url": "https://qoglsyykgrqalsemigii.supabase.co/storage/v1/object/public/case-images/3x3_cfop_oll_26.svg",
    "image_asset_name": "3x3_cfop_oll_26",
    "difficulty": 1,
    "popularity": 100,
    "groups": [
      "pattern:corners_only",
      "shape:cross",
      "corners:two_adjacent",
      "level:beginner"
    ],
    "created_at": "2025-11-09T00:00:00.000Z",
    "updated_at": "2025-11-15T10:15:50.520Z"
  },
  {
    "id": "d5635e93-c473-55a9-83a5-239d2182b4d1",
    "code": "OcLL H",
    "case_set_id": "92b51515-6df7-4548-87b0-b4445323b509",
    "title": "H",
    "long_name": "OcLL H Case (OLL 21)",
    "kind": "ocll",
    "pattern_from": "Top Edges Oriented",
    "pattern_to": "Top Oriented",
    "scramble": "(R U R' U) (R U' R' U) (R U2 R')",
    "notes": "Four corners with opposite orientation, forms an H pattern",
    "story": null,
    "description": null,
    "image_url": "https://qoglsyykgrqalsemigii.supabase.co/storage/v1/object/public/case-images/3x3_cfop_oll_21.svg",
    "image_asset_name": "3x3_cfop_oll_21",
    "difficulty": 2,
    "popularity": 90,
    "groups": [
      "pattern:corners_only",
      "shape:cross",
      "corners:none_oriented",
      "level:beginner"
    ],
    "created_at": "2025-11-09T00:00:00.000Z",
    "updated_at": "2025-11-15T10:15:50.520Z"
  },
  {
    "id": "4bd41d86-d5c1-5d91-8892-2f4f6ad8c016",
    "code": "OcLL L",
    "case_set_id": "92b51515-6df7-4548-87b0-b4445323b509",
    "title": "L",
    "long_name": "OcLL L Case (OLL 25)",
    "kind": "ocll",
    "pattern_from": "Top Edges Oriented",
    "pattern_to": "Top Oriented",
    "scramble": "U' L' (R U R' U') L (U R U' R')",
    "notes": "Diagonal headlights, forms an L shape",
    "story": null,
    "description": null,
    "image_url": "https://qoglsyykgrqalsemigii.supabase.co/storage/v1/object/public/case-images/3x3_cfop_oll_25.svg",
    "image_asset_name": "3x3_cfop_oll_25",
    "difficulty": 2,
    "popularity": 80,
    "groups": [
      "pattern:corners_only",
      "shape:cross",
      "corners:two_adjacent",
      "level:beginner"
    ],
    "created_at": "2025-11-09T00:00:00.000Z",
    "updated_at": "2025-11-15T10:15:50.520Z"
  },
  {
    "id": "cc774d90-91bb-5dd3-bbef-5e267aac4e69",
    "code": "OcLL Pi",
    "case_set_id": "92b51515-6df7-4548-87b0-b4445323b509",
    "title": "Pi",
    "long_name": "OcLL Pi Case (OLL 22)",
    "kind": "ocll",
    "pattern_from": "Top Edges Oriented",
    "pattern_to": "Top Oriented",
    "scramble": "R' U2' R2' U R2' U R2' U2' R'",
    "notes": "Headlights pattern on one side",
    "story": null,
    "description": null,
    "image_url": "https://qoglsyykgrqalsemigii.supabase.co/storage/v1/object/public/case-images/3x3_cfop_oll_22.svg",
    "image_asset_name": "3x3_cfop_oll_22",
    "difficulty": 2,
    "popularity": 90,
    "groups": [
      "pattern:corners_only",
      "shape:cross",
      "corners:none_oriented",
      "level:intermediate"
    ],
    "created_at": "2025-11-09T00:00:00.000Z",
    "updated_at": "2025-11-15T10:15:50.520Z"
  },
  {
    "id": "4b400596-f9a9-5dce-b69f-786cb28ea8e5",
    "code": "OcLL Sune",
    "case_set_id": "92b51515-6df7-4548-87b0-b4445323b509",
    "title": "Sune",
    "long_name": "OcLL Sune (OLL 27)",
    "kind": "ocll",
    "pattern_from": "Top Edges Oriented",
    "pattern_to": "Top Oriented",
    "scramble": "(R U R' U) (R U2 R')",
    "notes": "One of the most common OcLL cases",
    "story": "Named after Swedish cuber Lars Petrus's friend Sune",
    "description": null,
    "image_url": "https://qoglsyykgrqalsemigii.supabase.co/storage/v1/object/public/case-images/3x3_cfop_oll_27.svg",
    "image_asset_name": "3x3_cfop_oll_27",
    "difficulty": 1,
    "popularity": 100,
    "groups": [
      "pattern:corners_only",
      "shape:cross",
      "corners:two_adjacent",
      "level:beginner"
    ],
    "created_at": "2025-11-09T00:00:00.000Z",
    "updated_at": "2025-11-15T10:15:50.520Z"
  },
  {
    "id": "bed5663f-850f-5769-ae84-d75e6e009d37",
    "code": "OcLL T",
    "case_set_id": "92b51515-6df7-4548-87b0-b4445323b509",
    "title": "T",
    "long_name": "OcLL T Case (OLL 24)",
    "kind": "ocll",
    "pattern_from": "Top Edges Oriented",
    "pattern_to": "Top Oriented",
    "scramble": "U' (R U R' U') L' (U R U' R') L",
    "notes": "Headlights on front, forms a T shape",
    "story": null,
    "description": null,
    "image_url": "https://qoglsyykgrqalsemigii.supabase.co/storage/v1/object/public/case-images/3x3_cfop_oll_24.svg",
    "image_asset_name": "3x3_cfop_oll_24",
    "difficulty": 2,
    "popularity": 85,
    "groups": [
      "pattern:corners_only",
      "shape:cross",
      "corners:two_diagonal",
      "level:beginner"
    ],
    "created_at": "2025-11-09T00:00:00.000Z",
    "updated_at": "2025-11-15T10:15:50.520Z"
  },
  {
    "id": "ba5ffad8-8c3d-5f72-9196-31d4a46a860b",
    "code": "OcLL U",
    "case_set_id": "92b51515-6df7-4548-87b0-b4445323b509",
    "title": "U",
    "long_name": "OcLL U Case (OLL 23)",
    "kind": "ocll",
    "pattern_from": "Top Edges Oriented",
    "pattern_to": "Top Oriented",
    "scramble": "R U2' R D R' U2' R D' R2'",
    "notes": "Headlights on back, forms a U shape",
    "story": null,
    "description": null,
    "image_url": "https://qoglsyykgrqalsemigii.supabase.co/storage/v1/object/public/case-images/3x3_cfop_oll_23.svg",
    "image_asset_name": "3x3_cfop_oll_23",
    "difficulty": 2,
    "popularity": 85,
    "groups": [
      "pattern:corners_only",
      "shape:cross",
      "corners:two_diagonal",
      "level:beginner"
    ],
    "created_at": "2025-11-09T00:00:00.000Z",
    "updated_at": "2025-11-15T10:15:50.520Z"
  }
]