[
  {
    "id": "0d1e2f3a-4b5c-6d7e-8f9a-0b1c2d3e4f5a",
    "code": "3x3_lbl_top-cross-01",
    "case_set_id": "5c6d7e8f-9a0b-1c2d-3e4f-5a6b7c8d9e0f",
    "title": "Sitting (L-Shape)",
    "long_name": null,
    "kind": "lbl_top_cross",
    "pattern_from": "Second Layer Complete",
    "pattern_to": "Top Cross",
    "scramble": "F R U R' U' F'",
    "notes": "Two yellow edges form an L-shape. Position L on the left before applying. FUR says URF - easiest case, apply once.",
    "story": "L-shape sits in the corner - just one application needed",
    "description": "Two adjacent yellow edges oriented forming L-shape",
    "image_url": null,
    "image_asset_name": "3x3_lbl_top-cross_01",
    "difficulty": 2,
    "popularity": 85,
    "groups": [],
    "created_at": "2025-01-13T00:00:00.000Z",
    "updated_at": "2025-12-04T00:00:00.000Z"
  },
  {
    "id": "1e2f3a4b-5c6d-7e8f-9a0b-1c2d3e4f5a6c",
    "code": "3x3_lbl_top-cross-02",
    "case_set_id": "5c6d7e8f-9a0b-1c2d-3e4f-5a6b7c8d9e0f",
    "title": "Lying (I-Shape)",
    "long_name": null,
    "kind": "lbl_top_cross",
    "pattern_from": "Second Layer Complete",
    "pattern_to": "Top Cross",
    "scramble": "F R U R' U' F' F R U R' U' F'",
    "notes": "Two opposite yellow edges form an I-shape line. Apply algorithm twice.",
    "story": "I-shape lies flat - needs two applications to stand up",
    "description": "Two opposite yellow edges oriented forming I-shape",
    "image_url": null,
    "image_asset_name": "3x3_lbl_top-cross_02",
    "difficulty": 2,
    "popularity": 90,
    "groups": [],
    "created_at": "2025-12-04T00:00:00.000Z",
    "updated_at": "2025-12-04T00:00:00.000Z"
  },
  {
    "id": "2f3a4b5c-6d7e-8f9a-0b1c-2d3e4f5a6b7d",
    "code": "3x3_lbl_top-cross-03",
    "case_set_id": "5c6d7e8f-9a0b-1c2d-3e4f-5a6b7c8d9e0f",
    "title": "Standing (Dot-Shape)",
    "long_name": null,
    "kind": "lbl_top_cross",
    "pattern_from": "Second Layer Complete",
    "pattern_to": "Top Cross",
    "scramble": "(F R U R' U' F') (F R U R' U' F') U' (F R U R' U' F')",
    "notes": "No yellow edges oriented - only center visible (dot). Apply algorithm once, rotate top (U), then apply twice more consecutively.",
    "story": "The dot stands alone in the center - needs special sequence: 1x + U + 2x",
    "description": "No yellow edges oriented - only center showing as dot",
    "image_url": null,
    "image_asset_name": "3x3_lbl_top-cross_03",
    "difficulty": 2,
    "popularity": 95,
    "groups": [],
    "created_at": "2025-12-04T00:00:00.000Z",
    "updated_at": "2025-12-04T00:00:00.000Z"
  }
]