[
  {
    "id": "a1b2c3d4-e5f6-7890-abcd-ef1234567890",
    "code": "2X2-ORTEGA-OLL-1",
    "case_set_id": "8f3a7b2c-4d5e-6f1a-2b3c-4d5e6f7a8b9c",
    "title": "Sune",
    "long_name": "Ortega OLL Sune",
    "kind": "ortega_oll",
    "pattern_from": "One Face Solved",
    "pattern_to": "Opposite Face Oriented",
    "scramble": "R U2 R' U' R U' R'",
    "notes": "Most common OLL case on 2x2",
    "story": "<!-- Case: Ortega-OLL-1 -->\n\n## Overview\nSune on a 2×2: one oriented corner on top and the remaining three follow a clockwise flow.\n\n## Recognition\n- Exactly one yellow corner faces up while the others wrap clockwise.\n- Small L-shape of yellow on the front-right side.\n- First layer remains solved from Ortega Step 1.\n\n## Technique\n1. Run `R U R' U R U2 R'` (Sune).\n2. Maintain orientation and transition straight into PBL.\n\n## Fingertricks\n- Anchor your right thumb on the front sticker so repeated R turns stay tight.\n- Use the `U2` as a breathing point to refocus on upcoming PBL recognition.\n\n## Common Mistakes\n- Mixing it up with Anti-Sune and running the algorithm backwards.\n\n## Practice\n- Drill Sunes back-to-back until you can execute without cube rotations.\n\n## Related Cases\n- [Ortega-OLL-2](deddal://case/Ortega-OLL-2) – Anti-Sune mirror.\n- [Ortega-OLL-3](deddal://case/Ortega-OLL-3) – U/Headlights pattern.\n\n## Pro Tips\n- Label this case “clockwise flow” during practice to avoid confusing it with Anti-Sune.",
    "description": "Headlights on right side when yellow face is on top",
    "image_url": "https://qoglsyykgrqalsemigii.supabase.co/storage/v1/object/public/case-images/2x2_ortega_oll_1.svg",
    "image_asset_name": "2x2_ortega_oll_1",
    "difficulty": 1,
    "popularity": 85,
    "groups": [
      "pattern:corners_only",
      "shape:sune",
      "corners:one_oriented",
      "level:beginner"
    ],
    "created_at": "2025-01-10T00:00:00.000Z",
    "updated_at": "2025-11-15T10:15:50.520Z"
  },
  {
    "id": "b2c3d4e5-f6a7-8901-bcde-f12345678901",
    "code": "2X2-ORTEGA-OLL-2",
    "case_set_id": "8f3a7b2c-4d5e-6f1a-2b3c-4d5e6f7a8b9c",
    "title": "Anti-Sune",
    "long_name": "Ortega OLL Anti-Sune",
    "kind": "ortega_oll",
    "pattern_from": "One Face Solved",
    "pattern_to": "Opposite Face Oriented",
    "scramble": "R U R' U R U2 R'",
    "notes": "Mirror of Sune",
    "story": "<!-- Case: Ortega-OLL-2 -->\n\n## Overview\nAnti-Sune on 2×2: one corner solved, but the remaining pattern flows counter-clockwise.\n\n## Recognition\n- One yellow corner faces up, but the adjacent ones form an inverted L (mirror of Sune).\n- Headlights appear on the left instead of the right.\n- First layer stays intact from step one.\n\n## Technique\n1. Execute `R U2 R' U' R U' R'` (Anti-Sune).\n2. Move straight into PBL once orientation is complete.\n\n## Fingertricks\n- Emphasize the opening `U2` to set spacing.\n- Keep the right thumb against the front face for stability.\n\n## Common Mistakes\n- Re-running Sune muscle memory and making the case worse.\n\n## Practice\n- Drill Anti-Sune immediately after Sune so you can toggle between the two.\n\n## Related Cases\n- [Ortega-OLL-1](deddal://case/Ortega-OLL-1) – Clockwise sibling.\n- [Ortega-OLL-3](deddal://case/Ortega-OLL-3) – Headlights case.\n\n## Pro Tips\n- Verbally note “anti” or “counter” before executing to prevent muscle-memory mistakes mid-solve.",
    "description": "Headlights on left side when yellow face is on top",
    "image_url": "https://qoglsyykgrqalsemigii.supabase.co/storage/v1/object/public/case-images/2x2_ortega_oll_2.svg",
    "image_asset_name": "2x2_ortega_oll_2",
    "difficulty": 1,
    "popularity": 85,
    "groups": [
      "pattern:corners_only",
      "shape:antisune",
      "corners:one_oriented",
      "level:beginner"
    ],
    "created_at": "2025-01-10T00:00:00.000Z",
    "updated_at": "2025-11-15T10:15:50.520Z"
  },
  {
    "id": "c3d4e5f6-a7b8-9012-cdef-123456789012",
    "code": "2X2-ORTEGA-OLL-3",
    "case_set_id": "8f3a7b2c-4d5e-6f1a-2b3c-4d5e6f7a8b9c",
    "title": "U / Headlights",
    "long_name": "Ortega OLL U",
    "kind": "ortega_oll",
    "pattern_from": "One Face Solved",
    "pattern_to": "Opposite Face Oriented",
    "scramble": "F R U R' U' F'",
    "notes": "Fast algorithm, only 6 moves",
    "story": "<!-- Case: Ortega-OLL-3 -->\n\n## Overview\nHeadlights/U case: two adjacent corners already face up while the other pair form headlights on the back.\n\n## Recognition\n- Two yellow corners together on the front, two twisted headlights on the back.\n- From above it looks like a U shape framing the unsolved stickers.\n- Easy to confuse with a solved top—double-check the back pair.\n\n## Technique\n1. Run `F R U R' U' F'` to orient the remaining corners.\n2. Proceed to PBL.\n\n## Fingertricks\n- Lead with the left index on `F` so right-hand grip remains stable.\n\n## Common Mistakes\n- Assuming the layer is solved because the front looks correct.\n\n## Practice\n- Pair this case with Sunes to ensure you can spot the difference quickly.\n\n## Related Cases\n- [Ortega-OLL-1](deddal://case/Ortega-OLL-1)\n- [Ortega-OLL-2](deddal://case/Ortega-OLL-2)\n\n## Pro Tips\n- Because this case is short, plan your PBL AUF during the final `F'` close.",
    "description": "Two adjacent matching stickers forming U-shape",
    "image_url": "https://qoglsyykgrqalsemigii.supabase.co/storage/v1/object/public/case-images/2x2_ortega_oll_3.svg",
    "image_asset_name": "2x2_ortega_oll_3",
    "difficulty": 1,
    "popularity": 75,
    "groups": [
      "pattern:corners_only",
      "shape:u",
      "corners:two_diagonal",
      "level:beginner"
    ],
    "created_at": "2025-01-10T00:00:00.000Z",
    "updated_at": "2025-11-15T10:15:50.520Z"
  },
  {
    "id": "d4e5f6a7-b8c9-0123-def1-234567890123",
    "code": "2X2-ORTEGA-OLL-4",
    "case_set_id": "8f3a7b2c-4d5e-6f1a-2b3c-4d5e6f7a8b9c",
    "title": "Pi / Bruno",
    "long_name": "Ortega OLL Pi",
    "kind": "ortega_oll",
    "pattern_from": "One Face Solved",
    "pattern_to": "Opposite Face Oriented",
    "scramble": "F R U R' U' R U R' U' F'",
    "notes": "Longest algorithm, but easy to remember as double sexy move",
    "story": "",
    "description": "Four corners pointing up, forming Pi shape or two bars parallel",
    "image_url": "https://qoglsyykgrqalsemigii.supabase.co/storage/v1/object/public/case-images/2x2_ortega_oll_4.svg",
    "image_asset_name": "2x2_ortega_oll_4",
    "difficulty": 2,
    "popularity": 70,
    "groups": [
      "pattern:corners_only",
      "shape:pi",
      "corners:two_adjacent",
      "level:beginner"
    ],
    "created_at": "2025-01-10T00:00:00.000Z",
    "updated_at": "2025-11-15T10:15:50.520Z"
  },
  {
    "id": "e5f6a7b8-c9d0-1234-ef12-345678901234",
    "code": "2X2-ORTEGA-OLL-5",
    "case_set_id": "8f3a7b2c-4d5e-6f1a-2b3c-4d5e6f7a8b9c",
    "title": "T / Chameleon",
    "long_name": "Ortega OLL T",
    "kind": "ortega_oll",
    "pattern_from": "One Face Solved",
    "pattern_to": "Opposite Face Oriented",
    "scramble": "F' R' F R U R U' R'",
    "notes": "T-shape is easy to recognize",
    "story": "",
    "description": "T-shape with horizontal bar on back when yellow on top",
    "image_url": "https://qoglsyykgrqalsemigii.supabase.co/storage/v1/object/public/case-images/2x2_ortega_oll_5.svg",
    "image_asset_name": "2x2_ortega_oll_5",
    "difficulty": 2,
    "popularity": 70,
    "groups": [
      "pattern:corners_only",
      "shape:t",
      "corners:two_adjacent",
      "level:beginner"
    ],
    "created_at": "2025-01-10T00:00:00.000Z",
    "updated_at": "2025-11-15T10:15:50.520Z"
  },
  {
    "id": "f6a7b8c9-d0e1-2345-f123-456789012345",
    "code": "2X2-ORTEGA-OLL-6",
    "case_set_id": "8f3a7b2c-4d5e-6f1a-2b3c-4d5e6f7a8b9c",
    "title": "H / Double Anti-Sune",
    "long_name": "Ortega OLL H",
    "kind": "ortega_oll",
    "pattern_from": "One Face Solved",
    "pattern_to": "Opposite Face Oriented",
    "scramble": "R2 U2 R U2 R2",
    "notes": "Least common OLL case, self-inverse algorithm",
    "story": "",
    "description": "H-shape with two horizontal bars opposite each other",
    "image_url": "https://qoglsyykgrqalsemigii.supabase.co/storage/v1/object/public/case-images/2x2_ortega_oll_6.svg",
    "image_asset_name": "2x2_ortega_oll_6",
    "difficulty": 1,
    "popularity": 50,
    "groups": [
      "pattern:corners_only",
      "shape:h",
      "corners:two_diagonal",
      "level:beginner"
    ],
    "created_at": "2025-01-10T00:00:00.000Z",
    "updated_at": "2025-11-15T10:15:50.520Z"
  },
  {
    "id": "a7b8c9d0-e1f2-3456-a123-567890123456",
    "code": "2X2-ORTEGA-OLL-7",
    "case_set_id": "8f3a7b2c-4d5e-6f1a-2b3c-4d5e6f7a8b9c",
    "title": "L / Bowtie",
    "long_name": "Ortega OLL L",
    "kind": "ortega_oll",
    "pattern_from": "One Face Solved",
    "pattern_to": "Opposite Face Oriented",
    "scramble": "F' R' U R U R' F R",
    "notes": "L-shape or bowtie pattern",
    "story": "",
    "description": "L-shape with two matching stickers forming an L, or bowtie pattern",
    "image_url": "https://qoglsyykgrqalsemigii.supabase.co/storage/v1/object/public/case-images/2x2_ortega_oll_7.svg",
    "image_asset_name": "2x2_ortega_oll_7",
    "difficulty": 2,
    "popularity": 70,
    "groups": [
      "pattern:corners_only",
      "shape:l",
      "corners:two_adjacent",
      "level:beginner"
    ],
    "created_at": "2025-01-10T00:00:00.000Z",
    "updated_at": "2025-11-15T10:15:50.520Z"
  }
]