[
  {
    "id": "7a8b9c0d-1e2f-3a4b-5c6d-7e8f9a0b1c2d",
    "code": "3X3-LBL-FIRST-LAYER-CORNERS-01",
    "case_set_id": "aa1b2c3d-4e5f-6a7b-8c9d-0e1f2a3b4c5d",
    "title": "First Layer Corner",
    "long_name": null,
    "kind": "lbl_first_layer_corners",
    "pattern_from": "Scrambled",
    "pattern_to": "First Layer Complete",
    "scramble": "R U R' U'",
    "notes": "Fundamental algorithm - appears throughout solving. Practice until it feels natural.",
    "story": "The base algorithm: right, up, left, down. Most important algorithm to learn.",
    "description": "Insert white corner into correct position. Repeat until all four corners are solved.",
    "image_url": null,
    "image_asset_name": "3x3_lbl_first-layer-corners_01",
    "difficulty": 1,
    "popularity": 100,
    "groups": [],
    "created_at": "2025-01-13T00:00:00.000Z",
    "updated_at": "2025-01-13T00:00:00.000Z"
  },
  {
    "id": "3b4c5d6e-7f8a-9b0c-1d2e-3f4a5b6c7d8e",
    "code": "3X3-LBL-FIRST-LAYER-CORNERS-HELPER",
    "case_set_id": "aa1b2c3d-4e5f-6a7b-8c9d-0e1f2a3b4c5d",
    "title": "Corner Helper",
    "long_name": null,
    "kind": "lbl_first_layer_corners",
    "pattern_from": "Scrambled",
    "pattern_to": "First Layer Complete",
    "scramble": "R' D' R D",
    "notes": "Helper algorithm to position white corners before insertion. Optional but useful.",
    "story": "Right-prime, down-prime, right, down",
    "description": "Move white corner from bottom layer to top without disrupting solved pieces",
    "image_url": null,
    "image_asset_name": "3x3_lbl_first-layer-corners-helper_01",
    "difficulty": 1,
    "popularity": 70,
    "groups": [],
    "created_at": "2025-01-13T00:00:00.000Z",
    "updated_at": "2025-01-13T00:00:00.000Z"
  }
]