[
  {
    "id": "b8c9d0e1-f2a3-4567-b123-678901234567",
    "code": "Ortega-PBL-1",
    "case_set_id": "9a4b8c3d-5e6f-7a2b-3c4d-5e6f7a8b9c0d",
    "title": "Adjacent / Adj",
    "long_name": "Ortega PBL Adjacent Swap",
    "kind": "ortega_pbl",
    "pattern_from": "Opposite Face Oriented",
    "pattern_to": "Solved",
    "scramble": "R U F2 R' U' R",
    "notes": "Two adjacent pieces need swapping (similar to T-Perm on 3x3)",
    "story": "",
    "description": "Two adjacent corners of same layer need to swap positions",
    "image_asset_name": "2x2_ortega_pbl_1",
    "difficulty": 2,
    "popularity": 80,
    "created_at": "2025-01-10T00:00:00Z",
    "updated_at": "2025-01-10T00:00:00Z",
    "groups": [
      "type:adjacent_swap",
      "layers:one_layer",
      "level:beginner"
    ]
  },
  {
    "id": "c9d0e1f2-a3b4-5678-c123-789012345678",
    "code": "Ortega-PBL-2",
    "case_set_id": "9a4b8c3d-5e6f-7a2b-3c4d-5e6f7a8b9c0d",
    "title": "Opposite / Opp",
    "long_name": "Ortega PBL Opposite Swap",
    "kind": "ortega_pbl",
    "pattern_from": "Opposite Face Oriented",
    "pattern_to": "Solved",
    "scramble": "F2 U' R' U R U F2 U R U' R'",
    "notes": "Two opposite pieces need swapping (similar to Y-Perm on 3x3)",
    "story": "",
    "description": "Two opposite corners of same layer need to swap positions",
    "image_asset_name": "2x2_ortega_pbl_2",
    "difficulty": 3,
    "popularity": 70,
    "created_at": "2025-01-10T00:00:00Z",
    "updated_at": "2025-01-10T00:00:00Z",
    "groups": [
      "type:diagonal_swap",
      "layers:one_layer",
      "level:intermediate"
    ]
  },
  {
    "id": "d0e1f2a3-b4c5-6789-d123-890123456789",
    "code": "Ortega-PBL-3",
    "case_set_id": "9a4b8c3d-5e6f-7a2b-3c4d-5e6f7a8b9c0d",
    "title": "Diagonal / Opp Opp",
    "long_name": "Ortega PBL Diagonal Swap",
    "kind": "ortega_pbl",
    "pattern_from": "Opposite Face Oriented",
    "pattern_to": "Solved",
    "scramble": "R2 F2 R2",
    "notes": "Easiest PBL case - only 3 moves, self-inverse",
    "story": "",
    "description": "Both layers have diagonal corner swaps (opposite corners in each layer)",
    "image_asset_name": "2x2_ortega_pbl_3",
    "difficulty": 1,
    "popularity": 90,
    "created_at": "2025-01-10T00:00:00Z",
    "updated_at": "2025-01-10T00:00:00Z",
    "groups": [
      "type:diagonal_swap",
      "layers:both_layers",
      "level:beginner"
    ]
  },
  {
    "id": "e1f2a3b4-c5d6-7890-e123-901234567890",
    "code": "Ortega-PBL-4",
    "case_set_id": "9a4b8c3d-5e6f-7a2b-3c4d-5e6f7a8b9c0d",
    "title": "Adj-Adj",
    "long_name": "Ortega PBL Adjacent-Adjacent",
    "kind": "ortega_pbl",
    "pattern_from": "Opposite Face Oriented",
    "pattern_to": "Solved",
    "scramble": "R2 U R2 U2 B2 U' R2",
    "notes": "Both layers need adjacent swaps in same orientation",
    "story": "",
    "description": "Both top and bottom layers have adjacent corner swaps in the same direction",
    "image_asset_name": "2x2_ortega_pbl_4",
    "difficulty": 3,
    "popularity": 65,
    "created_at": "2025-01-10T00:00:00Z",
    "updated_at": "2025-01-10T00:00:00Z",
    "groups": [
      "type:adjacent_swap",
      "layers:both_layers",
      "level:intermediate"
    ]
  },
  {
    "id": "f2a3b4c5-d6e7-8901-f123-012345678901",
    "code": "Ortega-PBL-5",
    "case_set_id": "9a4b8c3d-5e6f-7a2b-3c4d-5e6f7a8b9c0d",
    "title": "Adj-Opp",
    "long_name": "Ortega PBL Adjacent-Opposite",
    "kind": "ortega_pbl",
    "pattern_from": "Opposite Face Oriented",
    "pattern_to": "Solved",
    "scramble": "R U F2 R' U' R",
    "notes": "One layer has adjacent swap, other has diagonal swap",
    "story": "",
    "description": "One layer needs adjacent swap while other layer needs diagonal swap",
    "image_asset_name": "2x2_ortega_pbl_5",
    "difficulty": 2,
    "popularity": 75,
    "created_at": "2025-01-10T00:00:00Z",
    "updated_at": "2025-01-10T00:00:00Z",
    "groups": [
      "type:mixed_swap",
      "layers:both_layers",
      "level:beginner"
    ]
  }
]