[
  {
    "id": "b8c9d0e1-f2a3-4567-b123-678901234567",
    "code": "Ortega-PBL-1",
    "case_set_id": "9a4b8c3d-5e6f-7a2b-3c4d-5e6f7a8b9c0d",
    "title": "Adjacent / Adj",
    "long_name": "Ortega PBL Adjacent Swap",
    "kind": "ortega_pbl",
    "pattern_from": "Opposite Face Oriented",
    "pattern_to": "Solved",
    "scramble": "R U F2 R' U' R",
    "notes": "Two adjacent pieces need swapping (similar to T-Perm on 3x3)",
    "story": "<!-- Case: Ortega-PBL-1 -->\n\n## Overview\nAdjacent swap on one layer: keep one face solved while you swap two adjacent pieces on the opposite layer.\n\n## Recognition\n- Hold the solved layer on the right; the front layer needs an adjacent swap.\n- Opposite layer is already complete, so only one layer requires work.\n- From above you see a three-cycle arrow on the unsolved layer.\n\n## Technique\n1. Execute `R U' R F2 R' U R'`.\n2. Regrip back to neutral for any final AUF.\n\n## Fingertricks\n- Push `F2` with both thumbs simultaneously to keep the cube anchored.\n\n## Common Mistakes\n- Forgetting which face stays solved and accidentally disturbing both layers.\n\n## Practice\n- Alternate this case with Opp/Opp PBL to reinforce adjacent vs. opposite recognition.\n\n## Related Cases\n- [Ortega-PBL-2](deddal://case/Ortega-PBL-2)\n- [Ortega-PBL-3](deddal://case/Ortega-PBL-3)\n\n## Pro Tips\n- Use the solved layer to gauge AUF before you start—the final alignment becomes trivial.",
    "description": "Two adjacent corners of same layer need to swap positions",
    "image_url": "https://qoglsyykgrqalsemigii.supabase.co/storage/v1/object/public/case-images/2x2_ortega_pbl_1.svg",
    "image_asset_name": "2x2_ortega_pbl_1",
    "difficulty": 2,
    "popularity": 80,
    "groups": [
      "type:adjacent_swap",
      "layers:one_layer",
      "level:beginner"
    ],
    "created_at": "2025-01-10T00:00:00.000Z",
    "updated_at": "2025-11-15T10:15:50.520Z"
  },
  {
    "id": "c9d0e1f2-a3b4-5678-c123-789012345678",
    "code": "Ortega-PBL-2",
    "case_set_id": "9a4b8c3d-5e6f-7a2b-3c4d-5e6f7a8b9c0d",
    "title": "Opposite / Opp",
    "long_name": "Ortega PBL Opposite Swap",
    "kind": "ortega_pbl",
    "pattern_from": "Opposite Face Oriented",
    "pattern_to": "Solved",
    "scramble": "F2 U' R' U R U F2 U R U' R'",
    "notes": "Two opposite pieces need swapping (similar to Y-Perm on 3x3)",
    "story": "<!-- Case: Ortega-PBL-2 -->\n\n## Overview\nOpposite/opp PBL: both layers show opposite pieces that must swap across the face, effectively two U-perms stacked.\n\n## Recognition\n- Neither layer is solved; each shows opposite colors facing each other.\n- No adjacent matches anywhere on the cube.\n\n## Technique\n1. Run `R U' R' U' F2 U' R U R' U F2`.\n2. Check both layers for AUF and finish.\n\n## Fingertricks\n- Count the rhythm “R U' R' U' – F2 – U'...” to keep from losing track mid-sequence.\n\n## Common Mistakes\n- Mixing it up with the diagonal case and running the wrong alg.\n\n## Practice\n- Drill opposite and diagonal swaps consecutively so you can spot the difference instantly.\n\n## Related Cases\n- [Ortega-PBL-1](deddal://case/Ortega-PBL-1)\n- [Ortega-PBL-3](deddal://case/Ortega-PBL-3)\n\n## Pro Tips\n- Think of it as “two adj-swaps in a row”; this mental model helps you stay calm under pressure.",
    "description": "Two opposite corners of same layer need to swap positions",
    "image_url": "https://qoglsyykgrqalsemigii.supabase.co/storage/v1/object/public/case-images/2x2_ortega_pbl_2.svg",
    "image_asset_name": "2x2_ortega_pbl_2",
    "difficulty": 3,
    "popularity": 70,
    "groups": [
      "type:diagonal_swap",
      "layers:one_layer",
      "level:intermediate"
    ],
    "created_at": "2025-01-10T00:00:00.000Z",
    "updated_at": "2025-11-15T10:15:50.520Z"
  },
  {
    "id": "d0e1f2a3-b4c5-6789-d123-890123456789",
    "code": "Ortega-PBL-3",
    "case_set_id": "9a4b8c3d-5e6f-7a2b-3c4d-5e6f7a8b9c0d",
    "title": "Diagonal / Opp Opp",
    "long_name": "Ortega PBL Diagonal Swap",
    "kind": "ortega_pbl",
    "pattern_from": "Opposite Face Oriented",
    "pattern_to": "Solved",
    "scramble": "R2 F2 R2",
    "notes": "Easiest PBL case - only 3 moves, self-inverse",
    "story": "<!-- Case: Ortega-PBL-3 -->\n\n## Overview\nDiagonal/opp-opp: both layers need diagonal swaps—the quickest PBL, solved by three half turns.\n\n## Recognition\n- Each face shows two opposite colors with no adjacent matches.\n- Diagonal arrows point from front-right to back-left on both layers.\n\n## Technique\n1. Execute `R2 F2 R2`.\n2. Apply AUF as needed.\n\n## Fingertricks\n- Use forearm turns for each `R2` and double-thumb pushes for `F2` to avoid overshooting.\n\n## Common Mistakes\n- Running the opposite-swap alg and scrambling the cube.\n\n## Practice\n- Because it’s so short, focus on accuracy—one lockup ruins the solve.\n\n## Related Cases\n- [Ortega-PBL-2](deddal://case/Ortega-PBL-2)\n\n## Pro Tips\n- Pre-plan AUF before starting; the alg is over in three moves, so every millisecond counts.",
    "description": "Both layers have diagonal corner swaps (opposite corners in each layer)",
    "image_url": "https://qoglsyykgrqalsemigii.supabase.co/storage/v1/object/public/case-images/2x2_ortega_pbl_3.svg",
    "image_asset_name": "2x2_ortega_pbl_3",
    "difficulty": 1,
    "popularity": 90,
    "groups": [
      "type:diagonal_swap",
      "layers:both_layers",
      "level:beginner"
    ],
    "created_at": "2025-01-10T00:00:00.000Z",
    "updated_at": "2025-11-15T10:15:50.520Z"
  },
  {
    "id": "e1f2a3b4-c5d6-7890-e123-901234567890",
    "code": "Ortega-PBL-4",
    "case_set_id": "9a4b8c3d-5e6f-7a2b-3c4d-5e6f7a8b9c0d",
    "title": "Adj-Adj",
    "long_name": "Ortega PBL Adjacent-Adjacent",
    "kind": "ortega_pbl",
    "pattern_from": "Opposite Face Oriented",
    "pattern_to": "Solved",
    "scramble": "R2 U R2 U2 B2 U' R2",
    "notes": "Both layers need adjacent swaps in same orientation",
    "story": "",
    "description": "Both top and bottom layers have adjacent corner swaps in the same direction",
    "image_url": "https://qoglsyykgrqalsemigii.supabase.co/storage/v1/object/public/case-images/2x2_ortega_pbl_4.svg",
    "image_asset_name": "2x2_ortega_pbl_4",
    "difficulty": 3,
    "popularity": 65,
    "groups": [
      "type:adjacent_swap",
      "layers:both_layers",
      "level:intermediate"
    ],
    "created_at": "2025-01-10T00:00:00.000Z",
    "updated_at": "2025-11-15T10:15:50.520Z"
  },
  {
    "id": "f2a3b4c5-d6e7-8901-f123-012345678901",
    "code": "Ortega-PBL-5",
    "case_set_id": "9a4b8c3d-5e6f-7a2b-3c4d-5e6f7a8b9c0d",
    "title": "Adj-Opp",
    "long_name": "Ortega PBL Adjacent-Opposite",
    "kind": "ortega_pbl",
    "pattern_from": "Opposite Face Oriented",
    "pattern_to": "Solved",
    "scramble": "R U F2 R' U' R",
    "notes": "One layer has adjacent swap, other has diagonal swap",
    "story": "",
    "description": "One layer needs adjacent swap while other layer needs diagonal swap",
    "image_url": "https://qoglsyykgrqalsemigii.supabase.co/storage/v1/object/public/case-images/2x2_ortega_pbl_5.svg",
    "image_asset_name": "2x2_ortega_pbl_5",
    "difficulty": 2,
    "popularity": 75,
    "groups": [
      "type:mixed_swap",
      "layers:both_layers",
      "level:beginner"
    ],
    "created_at": "2025-01-10T00:00:00.000Z",
    "updated_at": "2025-11-15T10:15:50.520Z"
  }
]