[
  {
    "id": "e0111111-1111-1111-1111-111111111111",
    "code": "3X3-LSE-EO01",
    "case_set_id": "c1a2b3d4-e5f6-7890-abcd-ef1234567890",
    "title": "All Oriented",
    "long_name": null,
    "kind": "roux_lse_eo",
    "pattern_from": null,
    "pattern_to": "Edge Orientation",
    "scramble": "",
    "notes": null,
    "story": null,
    "description": null,
    "image_url": null,
    "image_asset_name": null,
    "difficulty": 1,
    "popularity": 100,
    "groups": [
      "group:skip"
    ],
    "created_at": "2025-12-18T15:51:57.713296+00:00",
    "updated_at": "2025-12-18T15:51:57.713296+00:00"
  },
  {
    "id": "e0222222-2222-2222-2222-222222222222",
    "code": "3X3-LSE-EO02",
    "case_set_id": "c1a2b3d4-e5f6-7890-abcd-ef1234567890",
    "title": "Front Arrow",
    "long_name": null,
    "kind": "roux_lse_eo",
    "pattern_from": null,
    "pattern_to": "Edge Orientation",
    "scramble": "M U M'",
    "notes": null,
    "story": null,
    "description": null,
    "image_url": null,
    "image_asset_name": null,
    "difficulty": 2,
    "popularity": 95,
    "groups": [
      "group:arrow"
    ],
    "created_at": "2025-12-18T15:52:18.86579+00:00",
    "updated_at": "2025-12-18T15:52:18.86579+00:00"
  },
  {
    "id": "e0333333-3333-3333-3333-333333333333",
    "code": "3X3-LSE-EO03",
    "case_set_id": "c1a2b3d4-e5f6-7890-abcd-ef1234567890",
    "title": "Back Arrow",
    "long_name": null,
    "kind": "roux_lse_eo",
    "pattern_from": null,
    "pattern_to": "Edge Orientation",
    "scramble": "M' U' M",
    "notes": null,
    "story": null,
    "description": null,
    "image_url": null,
    "image_asset_name": null,
    "difficulty": 2,
    "popularity": 95,
    "groups": [
      "group:arrow"
    ],
    "created_at": "2025-12-18T15:52:18.86579+00:00",
    "updated_at": "2025-12-18T15:52:18.86579+00:00"
  },
  {
    "id": "e0444444-4444-4444-4444-444444444444",
    "code": "3X3-LSE-EO04",
    "case_set_id": "c1a2b3d4-e5f6-7890-abcd-ef1234567890",
    "title": "2 Adjacent / 2",
    "long_name": null,
    "kind": "roux_lse_eo",
    "pattern_from": null,
    "pattern_to": "Edge Orientation",
    "scramble": "M U' M U2 M' U M'",
    "notes": null,
    "story": null,
    "description": null,
    "image_url": null,
    "image_asset_name": null,
    "difficulty": 3,
    "popularity": 80,
    "groups": [
      "group:2adj"
    ],
    "created_at": "2025-12-18T15:52:18.86579+00:00",
    "updated_at": "2025-12-18T15:52:18.86579+00:00"
  },
  {
    "id": "e0555555-5555-5555-5555-555555555555",
    "code": "3X3-LSE-EO05",
    "case_set_id": "c1a2b3d4-e5f6-7890-abcd-ef1234567890",
    "title": "Front 1 / 1",
    "long_name": null,
    "kind": "roux_lse_eo",
    "pattern_from": null,
    "pattern_to": "Edge Orientation",
    "scramble": "M' U M U M' U M'",
    "notes": null,
    "story": null,
    "description": null,
    "image_url": null,
    "image_asset_name": null,
    "difficulty": 3,
    "popularity": 75,
    "groups": [
      "group:1-1"
    ],
    "created_at": "2025-12-18T15:52:18.86579+00:00",
    "updated_at": "2025-12-18T15:52:18.86579+00:00"
  },
  {
    "id": "e0666666-6666-6666-6666-666666666666",
    "code": "3X3-LSE-EO06",
    "case_set_id": "c1a2b3d4-e5f6-7890-abcd-ef1234567890",
    "title": "Back 1 / 1",
    "long_name": null,
    "kind": "roux_lse_eo",
    "pattern_from": null,
    "pattern_to": "Edge Orientation",
    "scramble": "M U' M' U' M U' M'",
    "notes": null,
    "story": null,
    "description": null,
    "image_url": null,
    "image_asset_name": null,
    "difficulty": 3,
    "popularity": 75,
    "groups": [
      "group:1-1"
    ],
    "created_at": "2025-12-18T15:52:18.86579+00:00",
    "updated_at": "2025-12-18T15:52:18.86579+00:00"
  },
  {
    "id": "e0777777-7777-7777-7777-777777777777",
    "code": "3X3-LSE-EO07",
    "case_set_id": "c1a2b3d4-e5f6-7890-abcd-ef1234567890",
    "title": "2 Adjacent / 0",
    "long_name": null,
    "kind": "roux_lse_eo",
    "pattern_from": null,
    "pattern_to": "Edge Orientation",
    "scramble": "M U M U2 M U M'",
    "notes": null,
    "story": null,
    "description": null,
    "image_url": null,
    "image_asset_name": null,
    "difficulty": 3,
    "popularity": 70,
    "groups": [
      "group:2adj"
    ],
    "created_at": "2025-12-18T15:52:18.86579+00:00",
    "updated_at": "2025-12-18T15:52:18.86579+00:00"
  },
  {
    "id": "e0888888-8888-8888-8888-888888888888",
    "code": "3X3-LSE-EO08",
    "case_set_id": "c1a2b3d4-e5f6-7890-abcd-ef1234567890",
    "title": "2 Opposite / 2",
    "long_name": null,
    "kind": "roux_lse_eo",
    "pattern_from": null,
    "pattern_to": "Edge Orientation",
    "scramble": "M U' M' U' M' U M'",
    "notes": null,
    "story": null,
    "description": null,
    "image_url": null,
    "image_asset_name": null,
    "difficulty": 3,
    "popularity": 70,
    "groups": [
      "group:2opp"
    ],
    "created_at": "2025-12-18T15:52:18.86579+00:00",
    "updated_at": "2025-12-18T15:52:18.86579+00:00"
  },
  {
    "id": "e0999999-9999-9999-9999-999999999999",
    "code": "3X3-LSE-EO09",
    "case_set_id": "c1a2b3d4-e5f6-7890-abcd-ef1234567890",
    "title": "2 Opposite / 0",
    "long_name": null,
    "kind": "roux_lse_eo",
    "pattern_from": null,
    "pattern_to": "Edge Orientation",
    "scramble": "M U M' U M U' M'",
    "notes": null,
    "story": null,
    "description": null,
    "image_url": null,
    "image_asset_name": null,
    "difficulty": 3,
    "popularity": 65,
    "groups": [
      "group:2opp"
    ],
    "created_at": "2025-12-18T15:52:18.86579+00:00",
    "updated_at": "2025-12-18T15:52:18.86579+00:00"
  },
  {
    "id": "e0aaaaaa-aaaa-aaaa-aaaa-aaaaaaaaaaaa",
    "code": "3X3-LSE-EO10",
    "case_set_id": "c1a2b3d4-e5f6-7890-abcd-ef1234567890",
    "title": "All 6 Misoriented",
    "long_name": null,
    "kind": "roux_lse_eo",
    "pattern_from": null,
    "pattern_to": "Edge Orientation",
    "scramble": "M U M U M U M' U' M' U' M'",
    "notes": null,
    "story": null,
    "description": null,
    "image_url": null,
    "image_asset_name": null,
    "difficulty": 4,
    "popularity": 50,
    "groups": [
      "group:all6"
    ],
    "created_at": "2025-12-18T15:52:18.86579+00:00",
    "updated_at": "2025-12-18T15:52:18.86579+00:00"
  }
]