[
  {
    "id": "4b3050f4-94fa-528f-9bf4-c51fdf659cde",
    "code": "4X4-PLL-PARITY-ADJ",
    "case_set_id": "e7b0ec65-a228-5bab-bc74-402df7a6d51a",
    "title": "PLL Parity (Adjacent)",
    "long_name": "4×4 PLL Parity - Adjacent Edge Swap",
    "kind": "4x4_pll_parity",
    "pattern_from": "OLL Complete with Edge Parity",
    "pattern_to": "PLL Ready State",
    "scramble": "2R2 U2 2R2 Uw2 2R2 Uw2",
    "notes": "Two adjacent edges are swapped - impossible configuration on 3×3",
    "story": "After completing OLL, you notice two adjacent edge pieces need to swap. This parity occurs in 50% of 4×4 solves.",
    "description": "The most common PLL parity. Fix with a quick algorithm before applying regular PLL.",
    "image_url": null,
    "image_asset_name": "4x4_pll_parity_adj",
    "difficulty": 3,
    "popularity": 100,
    "groups": [
      "type:parity",
      "type:pll_parity",
      "puzzle:4x4",
      "stage:pll",
      "edges:adjacent_swap",
      "level:intermediate"
    ],
    "created_at": "2025-12-02T00:00:00+00:00",
    "updated_at": "2025-12-03T11:47:46.647883+00:00"
  },
  {
    "id": "47cd2442-3d02-5d55-a7a5-578ad4284e57",
    "code": "4X4-PLL-PARITY-DIAG",
    "case_set_id": "e7b0ec65-a228-5bab-bc74-402df7a6d51a",
    "title": "PLL Parity (Diagonal)",
    "long_name": "4×4 PLL Parity - Diagonal Edge Swap",
    "kind": "4x4_pll_parity",
    "pattern_from": "OLL Complete with Edge Parity",
    "pattern_to": "PLL Ready State",
    "scramble": "2R2 U2 2R2 Uw2 2R2 Uw2 F2",
    "notes": "Two diagonal edges are swapped",
    "story": "Diagonal edge swap configuration requiring parity fix.",
    "description": "Diagonal variation of PLL parity.",
    "image_url": null,
    "image_asset_name": "4x4_pll_parity_diag",
    "difficulty": 3,
    "popularity": 70,
    "groups": [
      "type:parity",
      "type:pll_parity",
      "puzzle:4x4",
      "stage:pll",
      "edges:diagonal_swap",
      "level:intermediate"
    ],
    "created_at": "2025-12-02T00:00:00+00:00",
    "updated_at": "2025-12-03T11:47:46.647883+00:00"
  },
  {
    "id": "6e778963-2886-5e72-a738-82b8a479de06",
    "code": "4X4-PLL-PARITY-OPP",
    "case_set_id": "e7b0ec65-a228-5bab-bc74-402df7a6d51a",
    "title": "PLL Parity (Opposite)",
    "long_name": "4×4 PLL Parity - Opposite Edge Swap",
    "kind": "4x4_pll_parity",
    "pattern_from": "OLL Complete with Edge Parity",
    "pattern_to": "PLL Ready State",
    "scramble": "2R2 U2 2R2 Uw2 2R2 Uw2 U2",
    "notes": "Two opposite edges are swapped",
    "story": "Similar to adjacent swap but with opposite edges affected.",
    "description": "Less common variation of PLL parity with opposite edges swapped.",
    "image_url": null,
    "image_asset_name": "4x4_pll_parity_opp",
    "difficulty": 3,
    "popularity": 75,
    "groups": [
      "type:parity",
      "type:pll_parity",
      "puzzle:4x4",
      "stage:pll",
      "edges:opposite_swap",
      "level:intermediate"
    ],
    "created_at": "2025-12-02T00:00:00+00:00",
    "updated_at": "2025-12-03T11:47:46.647883+00:00"
  },
  {
    "id": "89348e65-1342-541d-abd2-b5df73204d23",
    "code": "4X4-PLL-PARITY-U",
    "case_set_id": "e7b0ec65-a228-5bab-bc74-402df7a6d51a",
    "title": "PLL Parity + U-Perm",
    "long_name": "4×4 PLL Parity with U-Perm",
    "kind": "4x4_pll_parity",
    "pattern_from": "OLL Complete with Edge Parity",
    "pattern_to": "Solved",
    "scramble": "2R2 U2 2R2 Uw2 2R2 Uw2 R U' R U R U R U' R' U' R2",
    "notes": "PLL parity combined with U-perm case",
    "story": "Common combination case where parity and U-perm can be fixed together or separately.",
    "description": "Combined parity and U-perm case with optimized algorithm.",
    "image_url": null,
    "image_asset_name": "4x4_pll_parity_uperm",
    "difficulty": 4,
    "popularity": 85,
    "groups": [
      "type:parity",
      "type:pll_parity",
      "puzzle:4x4",
      "stage:pll",
      "combined:uperm",
      "level:advanced"
    ],
    "created_at": "2025-12-02T00:00:00+00:00",
    "updated_at": "2025-12-03T11:47:46.647883+00:00"
  }
]