[
  {
    "id": "292f4b56-4428-4bf9-927a-bb822a0a3e36",
    "code": "3X3-LBL-DAISY-01",
    "case_set_id": "2b3c4d5e-6f7a-8b9c-0d1e-2f3a4b5c6d7e",
    "title": "Edge on Top - Wrong Side",
    "long_name": null,
    "kind": "lbl_daisy",
    "pattern_from": "Scrambled",
    "pattern_to": "Daisy",
    "scramble": "U' R' U F'",
    "notes": "Most common mistake - edge is on top but white faces the side. Remove it and put it back correctly.",
    "story": "The white edge is almost there, but twisted the wrong way. We need to take it out and put it back correctly.",
    "description": "White edge already on top but white sticker faces the side. Remove it and bring it back correctly.",
    "image_url": null,
    "image_asset_name": "3x3_lbl_daisy_01",
    "difficulty": 2,
    "popularity": 80,
    "groups": [],
    "created_at": "2025-12-04T00:00:00.000Z",
    "updated_at": "2025-12-04T00:00:00.000Z"
  },
  {
    "id": "19e30fc0-5e03-4c64-a4c0-eb9596313500",
    "code": "3X3-LBL-DAISY-02",
    "case_set_id": "2b3c4d5e-6f7a-8b9c-0d1e-2f3a4b5c6d7e",
    "title": "Middle Edge - White Front",
    "long_name": null,
    "kind": "lbl_daisy",
    "pattern_from": "Scrambled",
    "pattern_to": "Daisy",
    "scramble": "R' U",
    "notes": "White edge in middle layer with white facing front. Rotate top to position, then extract upward.",
    "story": "The white edge is in the middle with white facing you. Rotate the top layer to make space, then bring it up to the daisy.",
    "description": "White edge in middle layer with white facing front. Use U' R to bring it to the top.",
    "image_url": null,
    "image_asset_name": "3x3_lbl_daisy_02",
    "difficulty": 2,
    "popularity": 90,
    "groups": [],
    "created_at": "2025-12-04T00:00:00.000Z",
    "updated_at": "2025-12-04T00:00:00.000Z"
  },
  {
    "id": "edece4c8-4a6d-44ab-afae-4f8e544f0b3f",
    "code": "3X3-LBL-DAISY-03",
    "case_set_id": "2b3c4d5e-6f7a-8b9c-0d1e-2f3a4b5c6d7e",
    "title": "Middle Edge - White Side",
    "long_name": null,
    "kind": "lbl_daisy",
    "pattern_from": "Scrambled",
    "pattern_to": "Daisy",
    "scramble": "F",
    "notes": "Simplest case - white edge in middle with white facing the side. One front turn brings it to the top.",
    "story": "The white edge is in the middle with white facing the side. A simple counterclockwise front turn brings it up to join the daisy.",
    "description": "White edge in middle layer with white facing side. Use F' to bring it to the top.",
    "image_url": null,
    "image_asset_name": "3x3_lbl_daisy_03",
    "difficulty": 1,
    "popularity": 75,
    "groups": [],
    "created_at": "2025-12-04T00:00:00.000Z",
    "updated_at": "2025-12-04T00:00:00.000Z"
  },
  {
    "id": "5e1f4c31-cb0a-47fc-9841-4ced6fcf8dd0",
    "code": "3X3-LBL-DAISY-04",
    "case_set_id": "2b3c4d5e-6f7a-8b9c-0d1e-2f3a4b5c6d7e",
    "title": "Bottom Edge - White Front",
    "long_name": null,
    "kind": "lbl_daisy",
    "pattern_from": "Scrambled",
    "pattern_to": "Daisy",
    "scramble": "R' U F",
    "notes": "White edge on bottom with white sticker facing you. Move it away, rotate top, then flip up.",
    "story": "The white edge is on the bottom with white facing forward. We move it to the side, rotate the top to make space, then flip it up to join the daisy.",
    "description": "White edge on bottom with white facing front. Use F' U' R to bring it to the top.",
    "image_url": null,
    "image_asset_name": "3x3_lbl_daisy_04",
    "difficulty": 2,
    "popularity": 85,
    "groups": [],
    "created_at": "2025-12-04T00:00:00.000Z",
    "updated_at": "2025-12-04T00:00:00.000Z"
  },
  {
    "id": "935d691a-7429-4844-b7f7-8ee3b2ade735",
    "code": "3X3-LBL-DAISY-05",
    "case_set_id": "2b3c4d5e-6f7a-8b9c-0d1e-2f3a4b5c6d7e",
    "title": "Bottom Edge - White Down",
    "long_name": null,
    "kind": "lbl_daisy",
    "pattern_from": "Scrambled",
    "pattern_to": "Daisy",
    "scramble": "F2",
    "notes": "Easiest case - white edge on bottom face with white facing down. Two turns flip it directly to the top.",
    "story": "The white edge is on the bottom, white side down. A double turn (F2) flips it straight to the top to join the daisy.",
    "description": "White edge on bottom with white facing down. Two turns flip it to the top.",
    "image_url": null,
    "image_asset_name": "3x3_lbl_daisy_05",
    "difficulty": 1,
    "popularity": 95,
    "groups": [],
    "created_at": "2025-12-04T00:00:00.000Z",
    "updated_at": "2025-12-04T00:00:00.000Z"
  }
]