[
  {
    "id": "2f3a4b5c-6d7e-8f9a-0b1c-2d3e4f5a6b7c",
    "code": "3X3-LBL-TOP-CORNERS-POSITION-01",
    "case_set_id": "7e8f9a0b-1c2d-3e4f-5a6b-7c8d9e0f1a2b",
    "title": "Corner Swap",
    "long_name": null,
    "kind": "lbl_top_corners_position",
    "pattern_from": "Top Corners Oriented",
    "pattern_to": "Top Corners Positioned",
    "scramble": "R' F R' B2 R F' R' B2 R2 U'",
    "notes": "Longer algorithm but only needs 1 application. Hold with solved pair on front.",
    "story": "T-Perm variant for beginners",
    "description": "Permute yellow corners to correct positions",
    "image_url": null,
    "image_asset_name": "3x3_lbl_top-corners-position_01",
    "difficulty": 3,
    "popularity": 85,
    "groups": [],
    "created_at": "2025-01-13T00:00:00+00:00",
    "updated_at": "2025-01-13T00:00:00+00:00"
  }
]