[
  {
    "id": "c19c1b89-abff-5de5-ac99-f95c975da2bb",
    "code": "6X6-PLL-PARITY-ADJ",
    "case_set_id": "5102d166-a0f4-5e46-9ab8-eb98d90a022a",
    "title": "PLL Parity (Adjacent)",
    "long_name": "6×6 PLL Parity - Adjacent Edge Swap",
    "kind": "6x6_pll_parity",
    "pattern_from": "OLL Complete with Edge Parity",
    "pattern_to": "PLL Ready State",
    "scramble": "3R2 U2 3R2 Uw2 3R2 Uw2",
    "notes": "Two adjacent edges are swapped - impossible configuration on 3×3",
    "story": "Like 4×4, 6×6 experiences PLL parity in 50% of solves. The fix uses 3-layer moves (3R) instead of 2-layer.",
    "description": "The most common 6×6 PLL parity. Fix with algorithm before applying regular PLL.",
    "image_url": null,
    "image_asset_name": "6x6_pll_parity_adj",
    "difficulty": 4,
    "popularity": 100,
    "groups": [
      "type:parity",
      "type:pll_parity",
      "puzzle:6x6",
      "stage:pll",
      "edges:adjacent_swap",
      "level:advanced"
    ],
    "created_at": "2025-12-02T00:00:00.000Z",
    "updated_at": "2025-12-03T11:47:46.647Z"
  },
  {
    "id": "c9c4e5ae-fe17-5201-b2e1-3fe31bd04ab7",
    "code": "6X6-PLL-PARITY-DIAG",
    "case_set_id": "5102d166-a0f4-5e46-9ab8-eb98d90a022a",
    "title": "PLL Parity (Diagonal)",
    "long_name": "6×6 PLL Parity - Diagonal Edge Swap",
    "kind": "6x6_pll_parity",
    "pattern_from": "OLL Complete with Edge Parity",
    "pattern_to": "PLL Ready State",
    "scramble": "3R2 U2 3R2 Uw2 3R2 Uw2 F2",
    "notes": "Two diagonal edges are swapped",
    "story": "Diagonal configuration of 6×6 PLL parity.",
    "description": "Diagonal variation of PLL parity.",
    "image_url": null,
    "image_asset_name": "6x6_pll_parity_diag",
    "difficulty": 4,
    "popularity": 70,
    "groups": [
      "type:parity",
      "type:pll_parity",
      "puzzle:6x6",
      "stage:pll",
      "edges:diagonal_swap",
      "level:advanced"
    ],
    "created_at": "2025-12-02T00:00:00.000Z",
    "updated_at": "2025-12-03T11:47:46.647Z"
  },
  {
    "id": "fc2f4601-fbf6-5aa3-8372-7c16d5ea3f1a",
    "code": "6X6-PLL-PARITY-OPP",
    "case_set_id": "5102d166-a0f4-5e46-9ab8-eb98d90a022a",
    "title": "PLL Parity (Opposite)",
    "long_name": "6×6 PLL Parity - Opposite Edge Swap",
    "kind": "6x6_pll_parity",
    "pattern_from": "OLL Complete with Edge Parity",
    "pattern_to": "PLL Ready State",
    "scramble": "3R2 U2 3R2 Uw2 3R2 Uw2 U2",
    "notes": "Two opposite edges are swapped",
    "story": "Opposite edge variation of 6×6 PLL parity.",
    "description": "Less common variation with opposite edges swapped.",
    "image_url": null,
    "image_asset_name": "6x6_pll_parity_opp",
    "difficulty": 4,
    "popularity": 75,
    "groups": [
      "type:parity",
      "type:pll_parity",
      "puzzle:6x6",
      "stage:pll",
      "edges:opposite_swap",
      "level:advanced"
    ],
    "created_at": "2025-12-02T00:00:00.000Z",
    "updated_at": "2025-12-03T11:47:46.647Z"
  },
  {
    "id": "82a83bad-d052-59c3-851c-e03a64765cbf",
    "code": "6X6-PLL-PARITY-U",
    "case_set_id": "5102d166-a0f4-5e46-9ab8-eb98d90a022a",
    "title": "PLL Parity + U-Perm",
    "long_name": "6×6 PLL Parity with U-Perm",
    "kind": "6x6_pll_parity",
    "pattern_from": "OLL Complete with Edge Parity",
    "pattern_to": "Solved",
    "scramble": "3R2 U2 3R2 Uw2 3R2 Uw2 R U' R U R U R U' R' U' R2",
    "notes": "PLL parity combined with U-perm case",
    "story": "Combined case on 6×6 where parity and U-perm can be solved together.",
    "description": "Combined parity and U-perm case with optimized algorithm.",
    "image_url": null,
    "image_asset_name": "6x6_pll_parity_uperm",
    "difficulty": 5,
    "popularity": 85,
    "groups": [
      "type:parity",
      "type:pll_parity",
      "puzzle:6x6",
      "stage:pll",
      "combined:uperm",
      "level:advanced"
    ],
    "created_at": "2025-12-02T00:00:00.000Z",
    "updated_at": "2025-12-03T11:47:46.647Z"
  }
]