[
  {
    "id": "d79ed577-3406-5568-8aee-f297c5274411",
    "code": "PeLL H",
    "case_set_id": "ec357901-ea70-4901-a061-4e34ecb341f8",
    "title": "H Perm",
    "long_name": "PeLL H Permutation",
    "kind": "pell",
    "pattern_from": "Top Corners Permuted",
    "pattern_to": "Solved",
    "notes": "Two pairs of adjacent edges swapped",
    "difficulty": 3,
    "popularity": 85,
    "created_at": "2025-11-09T00:00:00Z",
    "updated_at": "2025-11-09T00:00:00Z",
    "scramble": "(M2 U' M2) U2 (M2 U' M2)",
    "image_asset_name": "3x3_cfop_pll_h-perm",
    "groups": [
      "type:edge_swap",
      "type:diagonal_swap",
      "edges:two_swap",
      "corners:solved",
      "level:intermediate"
    ],
    "description": null,
    "image_url": null,
    "story": null
  },
  {
    "id": "8949167c-4de1-5547-90a0-fd8f7d7947d2",
    "code": "PeLL Ua",
    "case_set_id": "ec357901-ea70-4901-a061-4e34ecb341f8",
    "title": "Ua Perm",
    "long_name": "PeLL Ua Permutation",
    "kind": "pell",
    "pattern_from": "Top Corners Permuted",
    "pattern_to": "Solved",
    "notes": "3-cycle of edges, counterclockwise",
    "difficulty": 2,
    "popularity": 100,
    "created_at": "2025-11-09T00:00:00Z",
    "updated_at": "2025-11-09T00:00:00Z",
    "scramble": "M2 U M' U2 M U M2",
    "image_asset_name": "3x3_cfop_pll_ua-perm",
    "groups": [
      "type:edge_swap",
      "type:adjacent_swap",
      "edges:three_cycle",
      "corners:solved",
      "level:beginner"
    ],
    "description": null,
    "image_url": null,
    "story": null
  },
  {
    "id": "d22cc76f-444b-539e-bf50-8931d124d60f",
    "code": "PeLL Ub",
    "case_set_id": "ec357901-ea70-4901-a061-4e34ecb341f8",
    "title": "Ub Perm",
    "long_name": "PeLL Ub Permutation",
    "kind": "pell",
    "pattern_from": "Top Corners Permuted",
    "pattern_to": "Solved",
    "notes": "3-cycle of edges, clockwise",
    "difficulty": 2,
    "popularity": 100,
    "created_at": "2025-11-09T00:00:00Z",
    "updated_at": "2025-11-09T00:00:00Z",
    "scramble": "R' U (R' U') (R' U') R' U (R U R2)",
    "image_asset_name": "3x3_cfop_pll_ub-perm",
    "groups": [
      "type:edge_swap",
      "type:adjacent_swap",
      "edges:three_cycle",
      "corners:solved",
      "level:beginner"
    ],
    "description": null,
    "image_url": null,
    "story": null
  },
  {
    "id": "707cea01-2868-52e6-b5fb-13ecc8bc2e4a",
    "code": "PeLL Z",
    "case_set_id": "ec357901-ea70-4901-a061-4e34ecb341f8",
    "title": "Z Perm",
    "long_name": "PeLL Z Permutation",
    "kind": "pell",
    "pattern_from": "Top Corners Permuted",
    "pattern_to": "Solved",
    "notes": "Two pairs of opposite edges swapped",
    "difficulty": 3,
    "popularity": 90,
    "created_at": "2025-11-09T00:00:00Z",
    "updated_at": "2025-11-09T00:00:00Z",
    "scramble": "M' U (M2 U) (M2 U) M' U2 M2 [U']",
    "image_asset_name": "3x3_cfop_pll_z-perm",
    "groups": [
      "type:edge_swap",
      "type:diagonal_swap",
      "edges:two_swap",
      "corners:solved",
      "level:intermediate"
    ],
    "description": null,
    "image_url": null,
    "story": null
  }
]